{
  "id": "<uuid>",
  "executionId": "exec-003",
  "traceId": "trace-003",
  "parentTraceId": null,
  "questId": "quest-003",
  "workflowExecutionId": "<workflow-exec-id>",
  "workflowName": "example_workflow",
  "status": "paused",
  "error": {
    "category": "PAUSED",
    "message": "Workflow paused (approval required)",
    "recoverable": true,
    "retryable": false
  },
  "startTime": "2026-01-30T10:20:00Z",
  "endTime": "2026-01-30T10:20:01Z",
  "workflow": {
    "id": "<workflow-exec-id>",
    "name": "example_workflow",
    "owner": "aegis",
    "status": "paused",
    "createdAt": "2026-01-30T10:20:00Z",
    "updatedAt": "2026-01-30T10:20:01Z",
    "startedAt": "2026-01-30T10:20:00Z",
    "completedAt": null,
    "errorMessage": null,
    "rollbackReason": null
  },
  "steps": [
    {
      "stepId": "fetch_report",
      "stepName": "fetch_report",
      "capabilityId": "io.http.get",
      "agentName": "aegis",
      "status": "completed",
      "startedAt": "2026-01-30T10:20:00Z",
      "completedAt": "2026-01-30T10:20:01Z",
      "inputs": {
        "url": "https://example.com/report.pdf"
      },
      "outputs": {
        "status_code": 200
      },
      "errorMessage": null,
      "executionOrder": 1
    },
    {
      "stepId": "handshake",
      "stepName": "handshake",
      "capabilityId": "sys.human_approval",
      "agentName": "aegis",
      "status": "paused",
      "startedAt": "2026-01-30T10:20:01Z",
      "completedAt": null,
      "inputs": {
        "reason": "requires authorization"
      },
      "outputs": null,
      "errorMessage": null,
      "executionOrder": 2
    }
  ],
  "userId": "user-003",
  "metadata": {
    "failureCategory": "PAUSED"
  }
}
